[
  {
    "id": "demo-one",
    "title": "合成示例：阅读工具新增收藏功能",
    "account": "合成示例号甲",
    "url": "https://example.com/wechat-reader/demo-one",
    "content_text": "这是为工具包验证格式而编写的合成文章，不对应任何真实公司或新闻。\n示例阅读工具本周增加了收藏功能，用户可以将同一主题的文章放入一个列表，并为每篇文章添加备注。收藏列表支持按添加时间排序，也可以手动调整顺序。\n目前测试只覆盖十名内部体验者，尚未公开用户留存或使用频次。团队计划在下一次测试中观察用户是否会再次打开收藏列表。这些设定仅用于演示如何保留事实与未知信息。",
    "content_kind": "fulltext",
    "content_hash": "0b042b56fa2f51723c79b5a65dfc78e937db6eee43185097cf9f19cf8dff3127",
    "published_at": "",
    "fetched_at": "2026-09-20T00:00:00+00:00",
    "provenance": "工具包作者编写的合成测试正文，不是公众号抓取结果"
  },
  {
    "id": "demo-two",
    "title": "合成示例：体验者希望导出阅读清单",
    "account": "合成示例号乙",
    "url": "https://example.com/wechat-reader/demo-two",
    "content_text": "这是另一篇合成文章，账号和访谈情节均为虚构。\n三名示例体验者提出，希望把阅读清单导出为 PDF，方便在没有网络时阅读。其中两人希望保留文章原始链接，一人主要关注自己的备注是否能完整导出。\n本次没有收集实际购买行为，也没有比较 PDF 和网页的阅读效果。后续可以让体验者使用两种格式完成同一项任务，再记录遗漏内容和重复操作；不能仅凭口头偏好判断付费意愿。",
    "content_kind": "fulltext",
    "content_hash": "9882062926da150ff1ec0ce2a582da0bcc4127aee79c4e5e6ce54f89663512e0",
    "published_at": "",
    "fetched_at": "2026-09-20T00:00:00+00:00",
    "provenance": "工具包作者编写的合成测试正文，不是公众号抓取结果"
  }
]